{"$schema":"https://json-schema.org/draft/2020-12/schema","$id":"https://aioffice.local/schemas/official-data-result.schema.json","title":"OfficialDataResult","type":"object","additionalProperties":false,"required":["schemaVersion","resultId","requestId","taskId","provider","capability","executionMode","status","createdAt","sources","observations","providerOutcomes","warnings","usage"],"properties":{"schemaVersion":{"const":"aioffice.official-data.v1"},"resultId":{"type":"string","minLength":1},"requestId":{"type":"string","minLength":1},"taskId":{"type":"string","minLength":1},"provider":{"enum":["fred","ecos","opendart"]},"capability":{"enum":["series_observations","release_metadata","statistics_observations","disclosure_list","filing_facts"]},"executionMode":{"const":"mock"},"status":{"enum":["completed","partial","retryable","failed"]},"createdAt":{"type":"string","format":"date-time"},"sources":{"type":"array","items":{"$ref":"#/$defs/source"}},"observations":{"type":"array","items":{"$ref":"#/$defs/observation"}},"providerOutcomes":{"type":"array","items":{"$ref":"#/$defs/outcome"}},"warnings":{"type":"array","uniqueItems":true,"items":{"enum":["stale_source","revised_observation","license_review_required","attribution_review_required","provider_rate_limited","provider_timeout","provider_unavailable","empty_result","partial_result"]}},"usage":{"$ref":"#/$defs/usage"}},"$defs":{"attribution":{"type":"object","additionalProperties":false,"required":["notice","reviewStatus"],"properties":{"notice":{"type":"string","minLength":1},"reviewStatus":{"enum":["not_required","required","unknown"]}}},"source":{"type":"object","additionalProperties":false,"required":["sourceId","provider","locator","collectedAt","freshness","attribution"],"properties":{"sourceId":{"type":"string","minLength":1},"provider":{"enum":["fred","ecos","opendart"]},"locator":{"type":"string","format":"uri"},"publishedDate":{"type":"string","format":"date"},"collectedAt":{"type":"string","format":"date-time"},"freshness":{"enum":["fresh","stale","unknown"]},"attribution":{"$ref":"#/$defs/attribution"}}},"observation":{"type":"object","additionalProperties":false,"required":["observationId","sourceId","observedDate","value","unit","revision","attributes"],"properties":{"observationId":{"type":"string","minLength":1},"sourceId":{"type":"string","minLength":1},"observedDate":{"type":"string","format":"date"},"value":{"type":["string","number","boolean","null"]},"unit":{"type":"string","minLength":1},"revision":{"enum":["initial","revised","unknown"]},"attributes":{"type":"object"}}},"outcome":{"type":"object","additionalProperties":false,"required":["provider","status","retryable"],"properties":{"provider":{"enum":["fred","ecos","opendart"]},"status":{"enum":["success","rate_limited","timeout","unavailable","invalid_configuration","malformed_response","empty_result","failed"]},"retryable":{"type":"boolean"},"retryAfterSeconds":{"type":"integer","minimum":0}}},"usage":{"type":"object","additionalProperties":false,"required":["actualCostKrw","simulated","estimatedRequests","estimatedCredits","estimatedTokens"],"properties":{"actualCostKrw":{"const":0},"simulated":{"const":true},"estimatedRequests":{"type":"integer","minimum":0},"estimatedCredits":{"type":"integer","minimum":0},"estimatedTokens":{"type":"integer","minimum":0}}}}}
