{"schemaVersion":"aioffice.official-data.v1","resultId":"official-result-fred","requestId":"official-request-fred","taskId":"official-task-fred","provider":"fred","capability":"series_observations","executionMode":"mock","status":"completed","createdAt":"2026-08-30T00:00:00Z","sources":[{"sourceId":"source-fred","provider":"fred","locator":"https://fred.test/series/synthetic","publishedDate":"2026-08-29","collectedAt":"2026-08-30T00:00:00Z","freshness":"fresh","attribution":{"notice":"Synthetic FRED fixture; no endorsement implied.","reviewStatus":"required"}}],"observations":[{"observationId":"observation-fred","sourceId":"source-fred","observedDate":"2026-08-29","value":"42.0","unit":"synthetic_units","revision":"initial","attributes":{"seriesIdentifier":"SYNTHETIC_SERIES"}}],"providerOutcomes":[{"provider":"fred","status":"success","retryable":false}],"warnings":["license_review_required"],"usage":{"actualCostKrw":0,"simulated":true,"estimatedRequests":1,"estimatedCredits":1,"estimatedTokens":0}}
